{
  "schema_version": "execution-authority-0.1",
  "updated_at": "2030-03-01T12:00:00Z",
  "authority_status": "SUPERSEDED",
  "campaign_id": "CAMPAIGN_LABEL_001",
  "campaign_lead_actor_id": "CAMPAIGN_LEAD_LABEL_API_001",
  "current_run_id": null,
  "baseline_ref": "baseline/ref-t1",
  "checkpoint_ref": null,
  "allowed_write_surfaces": [],
  "protected_surfaces": [
    "reviewed candidate",
    "CLIENT requirements"
  ],
  "expires_at": null
}
